	Job Title	Salary Estimate	Job Description	Rating	Company Name	Location	Size	Founded	Type of ownership	Industry	Sector	Revenue	Compensation_and_Benefits	Culture_and_Values	Career_Opportunities	Work_Life_Balance
209	Data Engineer	$69K - $116K (Glassdoor est.)	"Quotient Technology Inc. is currently seeking an Engineer for the Data Platform team to drive high quality data products and services to the market. This person will be responsible for design, develop and support products and services on top of our big data platform. This candidate demonstrates strong knowledge of data architecture and analytics development. Data quality as his/her passion, works well in some ambiguity. His / Her experience is filled with taking initiatives, patience, thoroughness, hands on working experience, willingness to work within a diverse distributed team. Possesses strong technical skills and prior experience in working with highly talented engineers is expected.

Position Responsibilities


Quotient (NYSE: QUOT) is the leading digital media and promotions technology company that creates cohesive omnichannel brand-building and sales-driving opportunities to deliver valuable outcomes for advertisers, retailers and consumers. The Quotient platform is powered by exclusive consumer spending data, location intelligence and purchase intent data to reach millions of shoppers daily and deliver measurable, incremental sales. Quotient partners with leading advertisers and retailers, including Clorox, Procter & Gamble, General Mills, Unilever, Albertsons Companies, CVS, Dollar General and Peapod Digital Labs, a company of Ahold Delhaize USA. Quotient is headquartered in Mountain View, California, and has offices across the US as well as in Bangalore, Paris, London and Tel Aviv. For more information visit www.quotient.com

Quotient is an equal opportunity employer. We celebrate diversity, and do not unlawfully discriminate on the basis of race, color, national origin, ancestry, creed, sex, gender, sexual orientation, gender identity or expression, age (40 and over), religion, political affiliation, citizenship, disability, marital or registered domestic partner status, veteran status, legally protected medical conditions, or any protected category prohibited by local, state or federal laws.

#LI-CS1"	4.6	"Quotient Technology Inc.
3.3"	Salt Lake City, UT	501 to 1000 Employees	1998	Company - Public	Advertising & Marketing	Business Services	$100 to $500 million (USD)	3.5 	3.2 	3.2	3.4
210	Senior Data Scientist	$98K - $164K (Glassdoor est.)	"RESPONSIBILITIES:
Kforce is working with a fast-growing global tech company in Los Angeles, CA and they are in search for a Senior Data Scientist. We are also growing our global reach, with offices in NY, London, Tel Aviv, LA, Bangkok, New Delhi, Sao Paulo and more. Our engineering Team builds high-scale, web and mobile e-commerce applications that run non-stop around the globe. We work in small collaborative teams to architect massively scalable and reliable systems. As a Sr. Data Scientist at this firm, you will work in our LA office with a very talented and tight-knit team, utilizing some of the latest technology and tools. This is a newly created role due to tremendous growth within the firm. You'll be surrounded by a small-knit team of incredibly bright professionals that come from diverse backgrounds.



Kforce is an Equal Opportunity/Affirmative Action Employer. All qualified applicants will receive consideration for employment without regard to race, color, religion, sex, pregnancy, sexual orientation, gender identity, national origin, age, protected veteran status, or disability status."	4.2	"Kforce
4.2"	Los Angeles, CA	10000+ Employees	1966	Company - Public	IT Services	Information Technology	$1 to $2 billion (USD)	3.6 	4.1 	3.8	3.8
211	Senior Data Scientist	$98K - $164K (Glassdoor est.)	"Company Description
Epsilon is the leader in outcome-based marketing. We enable marketing that’s built on proof, not promises. Through Epsilon PeopleCloud, the marketing platform for personalizing consumer journeys with performance transparency, Epsilon helps marketers anticipate, activate and prove measurable business outcomes. Powered by CORE ID®, the most accurate and stable identity management platform representing 200+ million people, Epsilon’s award-winning data and technology is rooted in privacy by design and underpinned by powerful AI. With more than 50 years of experience in personalization and performance working with the world’s top brands, agencies and publishers, Epsilon is a trusted partner leading CRM, digital media, loyalty and email programs. Positioned at the core of Publicis Groupe, Epsilon is a global company with over 8,000 employees in over 40 offices around the world. For more information, visit epsilon.com. Follow us on Twitter at @EpsilonMktg."	4.2	"Epsilon
3.6"	New York, NY	5001 to 10000 Employees	1969	Subsidiary or Business Segment	Advertising & Marketing	Business Services	$2 to $5 billion (USD)	3.3 	3.6 	3.3	3.9
212	Supply Chain Analytics Consultant	$98K - $164K (Glassdoor est.)	"Job
Description

ABOUT TREDENCE:

Tredence is a global analytics services and solutions company. Our capabilities range from Data Visualization, Data Management to Advanced analytics, Big Data and Machine Learning. Our uniqueness is in bringing the right mix of technology and business analytics to create sustainable white-box solutions that are transitioned to our clients at the end of the engagement. We do this cost effectively using a global execution model leveraging our clients' existing technology and data assets. We also come in with strong IP and pre-built analytics solutions in data mining, business intelligence and Big Data.





The Supply Chain Functional Consultant will play a crucial role in client implementation projects by conducting necessary reviews and analysis of the client’s supply chain processes. The ideal candidate has a growth mindset and will play a lead in driving the consulting engagement, working closely with client stakeholders and development project team members."	4.2	"Tredence
3.8"	San Jose, CA	501 to 1000 Employees	2013	Company - Private	Consulting	Business Services	$25 to $50 million (USD)	3.7 	4.0 	4.0	3.1
213	Scientist- Computational Biology- Biomarker Platform Development	$98K - $164K (Glassdoor est.)	"AllSTEM Connections is looking for a Scientist- Computational Biology. This role will be fully remote during Covid restrictions but must work and live in the Pacific time zone. Will be located in San Francisco when restrictions are lifted.
Our client is looking for a highly motivated Computational Biologist with expertise in clinical bioinformatics, biomarker development, assay development, data ETL and application development. This role will operate within a multi-disciplinary setting, working closely with computational biologists, biomarker scientists and data scientists to develop data ingestion, platform analysis and applications for analyzing and visualizing clinical trial datasets with a focus on clinical biomarkers."	4.2	AllSTEM - Jobs	San Francisco, CA	-1	-1	-1	-1	-1	-1	-1	-1	-1	-1
214	Mathematics, Statistics, or Data Science, Assistant Professor, Tenure-Track	$98K - $164K (Glassdoor est.)	"Taylor University is seeking applications and nominations of distinctive candidates for a tenure track Mathematics faculty position in the Mathematics Department beginning in August 2021. Rank and salary are dependent upon qualifications and experience.
Qualifications
Candidates must have a personal, vibrant faith and Christian walk and be strongly committed to the educational mission and evangelical Christian orientation of the University. Taylor University is a Christ-centered educational institution, and an evangelical, interdenominational covenant community committed to advancing life-long learning and ministering the redemptive love and truth of Jesus Christ to a world in need. Candidates will be expected to affirm the Taylor University Life Together Covenant, Statement of Faith, and essential documents."	4.2	"Taylor University
4.3"	Upland, IN	501 to 1000 Employees	1846	College / University	Colleges & Universities	Education	$50 to $100 million (USD)	3.4 	4.1 	3.4	3.6
215	Data Scientist, Medical Diagnostics	$98K - $164K (Glassdoor est.)	"The Company
The world is facing a medical crisis, bacteria are increasingly evolving resistance to even our strongest antibiotics. The problem is already very real and immediate; for example, bloodstream infection leading to sepsis is now responsible for more than half of all deaths in hospitals and is the most expensive condition treated in hospitals. Sepsis mortality rate increases >6% every hour without effective antibiotic treatment. Yet, despite the life and death urgency, and healthcare cost impacts, current methodologies require 3 days to determine the correct antibiotic.
Specific Diagnostics has developed a breakthrough solution to rapidly determine the effective antibiotic treatment for bloodstream and other acute infections. Used for bloodstream infection Specific’s solution provides results 2 days sooner than existing methods, saving patients suffering from drug-resistant infection."	4.2	"Specific Diagnostics
3.5"	Mountain View, CA	1 to 50 Employees	-1	Company - Private	-1	-1	Less than $1 million (USD)	3.8 	3.5 	3.6	3.6
216	Data Scientist	$98K - $164K (Glassdoor est.)	"Financial Data Scientist
We are looking for a strategic, experienced Financial Data Scientist to deliver financial analytics support services to deliver ongoing financial analytics needs. You will participate in the development of crucial data analytics collections and the development of high-level financial reporting capabilities. This role is perfect for someone who has an ownership mentality, is passionate about learning, researching, and finding the solutions that support a world-class culture and organization. You will leverage your experience and passion to drive results and exceed customer expectations.
Responsibilities:
Employ scientific methods, processes, algorithms, and systems to extract knowledge and insights from both structured and unstructured data from multiple disconnected sources."	4.2	Prominent Global Solutions	Fort Meade, MD	-1	-1	-1	-1	-1	-1	-1	-1	-1	-1
217	Data Engineer	$98K - $164K (Glassdoor est.)	"What you will do
Work with the team to load data into HealthVerity's data warehouse
Troubleshoot and resolve issues relating to data integrity
Help establish procedures and best practices for transforming and storing data
Lead requirements gathering around data pipeline automation improvements
Work with some of the most exciting open-source tools like Spark, Hadoop, Docker, Airflow, Zeppelin
Leverage distributed computing and serverless architecture such as AWS EMR & AWS Lambda, to develop pipelines for transforming data"	4.2	"HealthVerity
5.0"	Philadelphia, PA	51 to 200 Employees	2014	Company - Private	Enterprise Software & Network Solutions	Information Technology	Unknown / Non-Applicable	4.5 	5.0 	4.7	4.5
218	Machine Learning Data Engineer	$98K - $164K (Glassdoor est.)	"As a Machine Learning Data Engineer, you will be responsible for the continued development of the Lucd platforms ML data processing capabilities.
This primarily includes the following responsibilities.
Architecting and implementing large-scale distributed data transformation components and services for supporting applications and workflows such as AI experimentation and training, and visual analytics. There is an emphasis on using GPU-enabled capabilities.
Contributing to AI workflow governance solutions, especially regarding data quality and provenance."	4.2	Lucd	Remote	-1	-1	-1	-1	-1	-1	-1	-1	-1	-1
219	Sr Data Scientist - Advanced Conversational Techniques	$98K - $164K (Glassdoor est.)	"Company Description
Quiq is a fast-growing technology company based in Bozeman, MT. We make it easy for consumers to engage with companies via text messaging. Do you ever wish you could just message a company for help instead of having to call or email? Us too! Thats exactly why Quiq was founded. We strive to make everyones life easier by providing companies with a messaging platform Of note, our leadership team is extremely experienced in the customer service and customer experience marketspace, with numerous successes under their belt. As we continue to build Quiq, theres a perfect spot for you to grow with us.
Our Mission"	4.2	Quiq Inc	Remote	-1	-1	-1	-1	-1	-1	-1	-1	-1	-1
220	Data Analyst IV (Data Visualization, Python)	$98K - $164K (Glassdoor est.)	"Position Purpose:



Interpret and analyze data from multiple sources including claims, provider, member, and encounters data. Identify and assess the business impact of trends
Develop, maintain, and troubleshoot complex scripts and reports developed using SQL, Microsoft Excel, or other analytics tools
Lead the planning and execution of large-scale projects and new reporting tools, translating business goals into actionable solutions"	4.2	"Interpreta
3.5"	San Diego, CA	10000+ Employees	1984	Company - Public	Insurance Carriers	Insurance	$10+ billion (USD)	3.8 	3.4 	3.5	3.4
221	Data Scientist	$98K - $164K (Glassdoor est.)	"HE TEAM YOU WILL BE JOINING:
One of the largest providers of high-quality, single-family residences in the United States
A team of hard-working individuals who take pride in providing the highest quality of safety, security, and stability
A dynamic, highly progressive, and goal-oriented company with expectations of tripling in size over the next few years
Highly acquisitive in the real estate industry held by private equity
WHAT THEY OFFER YOU:"	4.2	"AccruePartners
2.4"	Charlotte, NC	51 to 200 Employees	2002	Company - Private	Staffing & Outsourcing	Business Services	$25 to $50 million (USD)	2.7 	2.4 	2.8	2.3
222	Product Development Lead Scientist	$98K - $164K (Glassdoor est.)	"Position Overview:
Catalent hires people with a passion to make a difference to the health of millions of people globally. Your expertise, coupled with Catalent’s advanced technologies and collaboration with thousands of innovative pharmaceutical, biotech and healthcare companies, will help bring life-enhancing products to the people you know and love. Your talents , ideas and passion are essential to our mission; to develop, manufacture and supply products that help people live better, healthier lives. Interested in learning more about life at Catalent? Start here
Product Development Lead Scientist"	4.2	"Catalent Pharma Solutions
3.5"	Saint Petersburg, FL	10000+ Employees	2007	Company - Public	Biotech & Pharmaceuticals	Biotech & Pharmaceuticals	$2 to $5 billion (USD)	3.5 	3.3 	3.4	2.9
223	Data Science Specialist	$98K - $164K (Glassdoor est.)	"Eaton Corporation is currently seeking a Data Science Specialist to join our team. This position can be based at our Moon Township PA, Menomonee Falls WI, Southfield MI, Cleveland OH or Raleigh NC facility. Relocation assistance will be provided if needed.

The Data Science Specialist will be directly involved in the application of statistics, machine learning, and analytic approaches to answer challenging business questions. This work will help businesses across the enterprise solve critical business problems, uncover new business opportunities, and turn their large volumes of data into valuable, actionable insights.

Making what matters work at Eaton takes the passion of every employee around the world. We create an environment where creativity, invention and discovery become reality, each and every day. It’s where bold, bright professionals like you can reach your full potential—and where you can help us reach ours."	4.2	Eaton	Menomonee Falls, WI	-1	-1	-1	-1	-1	-1	-1	-1	-1	-1
224	Data Architect	$98K - $164K (Glassdoor est.)	"Do you enjoy developing creative solutions to challenging problems?Do you want to make significant contributions to national security through software and systems engineering?Are you passionate about working with groundbreaking next generation technologies?If so, we are looking for someone like you to join us at APL.We are seeking a motivated and creative Data Architect to help us develop large-scale data architectures and designs to support some of the country's most critical national security challenges. You will push the boundaries across dynamic and large-scale data science systems, assuring the confidence in and performance of our machine learning, artificial intelligence, and data analytics systems. You will provide strategic technical leadership on emerging computer and data science and associated technologies, develop internal research projects and external collaborations, and advance artificial intelligence as a strategic advantage. Your will help us transform data into the knowledge that will enable decision-makers to make informed choices in defense of the nation. You will join a hardworking team in an inclusive environment where we value intellectual curiosity, innovation and creativity.
As a Data Architect you will...
You meet our minimum qualifications for this position if you...
Why work at APL?The Johns Hopkins University Applied Physics Laboratory (APL) brings world-class expertise to our nation's most critical defense, security, space and science challenges. While we are dedicated to solving complex challenges and pioneering new technologies, what makes us truly outstanding is our culture. We offer a vibrant, welcoming atmosphere where you can bring your authentic self to work, continue to grow, and build strong connections with inspiring teammates.At APL, we celebrate our differences and encourage creativity and bold, new ideas. Our employees enjoy generous benefits, including a robust education assistance program, unparalleled retirement contributions, and a healthy work/life balance. APL's campus is located in the Baltimore-Washington metro area. Learn more about our career opportunities at www.jhuapl.edu/careers."	4.2	Johns Hopkins Applied Physics Laboratory (APL)	Laurel, MD	-1	-1	-1	-1	-1	-1	-1	-1	-1	-1
225	Data Scientist	$98K - $164K (Glassdoor est.)	"Job Description Summary
Transamerica has been helping people feel better about the future for more than 100 years, and we’re proud of the trust we’ve earned. But we believe our responsibility goes beyond insurance, investments, and retirement accounts. We’re also in the business of helping people improve their financial and personal well-being, so they can add more years to their lives, and more life to their years.
Job Description
What You Will Do: As part of the Advanced Analytics group, the Data Scientist works with product managers, data engineers, and other data scientists to develop innovative solutions that transform the way Transamerica conducts business."	4.2	"Transamerica
3.0"	Denver, CO	5001 to 10000 Employees	1904	Subsidiary or Business Segment	Insurance Carriers	Insurance	$10+ billion (USD)	3.2 	3.1 	2.8	3.4
226	Clinical Data Scientist Team Lead (PhD or PharmD Required)	$98K - $164K (Glassdoor est.)	"Overview

DRT Strategies delivers expert management consulting and information technology (IT) solutions to large federal agencies, the U.S. Navy, state and local government and commercial clients in health care, technology, and the financial services industries.

The three letters of our name, DRT, stand for Driving Resolutions Together, which is the core philosophy on which the company was founded. That is, we collaborate with our clients to solve their most pressing IT challenges - together.

We are problem solvers dedicated to your success, combining Fortune 500 experience with small business responsiveness. We have established a reputation with our clients as a forward-thinking consulting firm with demonstrated success in implementing solutions that lead to meaningful results. Our world-class consultants unite people to work collaboratively to achieve project goals and make your vision a reality.



This project will support the Office of New Drugs within FDAs Center for Drug Evaluation and Research (CDER). Specifically, this project will support ONDs Integrated Review for Drug Marketing Applications program by providing comprehensive safety data analyses for new drug applications (NDAs) and biologics license applications (BLAs) in collaboration with clinical reviewers.



The Clinical Data Scientist Team Lead interacts with many FDA stakeholders across several Offices and Centers, specifically with clinical reviewers (Medical Officers) and statistical reviewers. This role will be responsible for reviewing safety data sufficiency and integrity, conducting safety data analyses, verifying safety data submitted by the applicant, and generating high-quality scientific reports. As a Task Order Lead, the position will include providing project management support to the team.

Presently, due to the COVID-19 pandemic, DRT employees are teleworking from home and leveraging video conferencing along with other virtual productivity tools. During normal circumstances, the requirement of this position is to be onsite, however, DRT has not yet determined when employees will be required to return to their workspaces. Please be aware that at the time a date is determined, the requirement of this position will be to report to the worksite.

DRT Strategies, Inc. (DRT) celebrates diversity and is proud to provide Equal Employment Opportunities (EEO) to all employees and applicants for employment without regard to race, color, religion, sex, sexual orientation, gender identity, national origin, age, genetics, disability, or protected veteran status. In addition to federal law requirements, DRT complies with applicable state and local laws governing non-discrimination in employment in every location in which the company has facilities.

Powered by JazzHR"	4.2	"DRT Strategies, Inc.
3.3"	Silver Spring, MD	201 to 500 Employees	2004	Company - Private	Federal Agencies	Government	$50 to $100 million (USD)	3.1 	3.2 	2.9	3.7
227	Development Scientist, Next Generation Sequencing	$98K - $164K (Glassdoor est.)	"Working as a member of the NEBNext Applications and Product Development Department at New England Biolabs (NEB), this individual will be focused on the development of cutting-edge technology for next generation sequencing applications.

Primary Responsibilities:
Develop next-generation sequencing sample prep methods, both by utilizing standard molecular biology processes and creating novel solutions.
Coordinate and support all stages of the transition of new products from development to product release, such as validating processes, establishing quality controls, setting launch dates, coordinating beta testing, writing protocols, and aiding marketing and business development groups in preparation of product launches.


New England Biolabs is committed to fostering a diverse and inclusive community; as an EEO/AA employer, New England Biolabs considers applicants for employment without regard to, and does not discriminate on the basis of, race, color, religion, sex, sexual orientation, gender identity, national origin, protected veteran status or disability. More in-depth details of EEO are available here.

Information regarding New England Biolabs commitment to Equity, Diversity and Inclusion can be found here.

New England Biolabs is a participating employer in the Employment Verification (E-Verify) program.

OFCCP’s pay transparency policy can be found on OFCCP’s website at www.dol.gov/ofccp

If you need an accommodation for any part of the employment process because of a medical condition or disability, please send an email to hr@neb.com or call 978-927-5054 to let us know the nature of your request."	4.2	"New England Biolabs
4.9"	Ipswich, MA	201 to 500 Employees	1974	Company - Private	Biotech & Pharmaceuticals	Biotech & Pharmaceuticals	Unknown / Non-Applicable	4.7 	5.0 	4.6	4.8
228	Contract Data Analyst	$98K - $164K (Glassdoor est.)	"Overview:
Amyx is seeking to hire a Contract Data Analyst located in Rosslyn, VA. The successful candidate must have A 4-year course of study leading to a bachelor's degree with a major in any field, that includes or is supplemented by at least 24 semester hours in any combination of the following fields: accounting, business, finance, law, contracts, purchasing, economics, industrial management, marketing, quantitative methods or organization. Also, a minimum of 2 years of experience serving as a Federal government and/or contractor employee in the GS-1102 series or equivalent capacity as a contract specialist/administrator or procurement analyst
Responsibilities:
Responsibilities and Skills:


Qualifications:"	4.2	"Amyx, Inc.
3.8"	Arlington, VA	501 to 1000 Employees	1999	Company - Private	IT Services	Information Technology	$50 to $100 million (USD)	4.0 	4.0 	3.5	3.9
229	Data Scientist	$98K - $164K (Glassdoor est.)	"Title

Data Scientist
Req #

2020-98702
Posted Date

6/11/2020
Category

Cyber Security
Job Locations

US-MD-Adelphi
Additional Locations

Location

US-MD-Adelphi
External Company Name

Perspecta Careers
External Company URL

Postal Code

20783
Address

2800 Powder Mill Road
Post End Date

Telecommute

No
Clearance

Top Secret/SCI"	4.2	"Perspecta
3.6"	Adelphi, MD	10000+ Employees	2018	Company - Public	Aerospace & Defense	Aerospace & Defense	Unknown / Non-Applicable	3.4 	3.5 	3.3	3.7
