	Job Title	Salary Estimate	Job Description	Rating	Company Name	Location	Size	Founded	Type of ownership	Industry	Sector	Revenue	Compensation_and_Benefits	Culture_and_Values	Career_Opportunities	Work_Life_Balance
0	Data Scientist	$64K - $106K (Glassdoor est.)	"XL Fleet seeks an experienced Data Scientist to support the data science activity for hybrid electric, plugin hybrid electric and full electric vehicle product lines.

About XL Fleet:

XL Fleet is on a mission to electrify the global fleet of commercial vehicles. We know this mission can only be successfully with the right talent.

XL is a high-growth commercial vehicle technology company. We are developing and producing cutting-edge technology to convert conventional vehicles into hybrids, plug-in hybrids and zero CO2 drive systems to reduce fuel consumption and to generate a compelling return on investment for fleet customers. Our customers include transportation, municipal, and utility fleets.

XL was honored as one of Boston Business Journal's Best Places to Work in 2018. We are an ambitious and small (but rapidly growing) team. We have a state-of-the-art engineering facility in Boston, California and Detroit and a production facility in Quincy, IL. We are looking for high-energy, creative, and ambitious professionals to join our team. We offer a competitive salary, meaningful equity compensation, 401k (with a company match), outstanding health benefits, progressive paid-time off policy, and a fun, productive and team-oriented work environment. We are recruiting candidates who have demonstrated leadership and excellence throughout their careers and are excited by the prospect of tackling the challenges of rapid profitable growth.



Responsibilities
Additional Responsibilities based on experience/interests
Minimum Qualifications
Preferred Qualifications
Contact: please send your resume to careers@xlfleet.com with “Data Scientist” in the subject heading"	5.0	"XL Fleet
5.0"	Detroit, MI	51 to 200 Employees	2012	Company - Public	Transportation Equipment Manufacturing	Manufacturing	$10 to $25 million (USD)	5.0 	5.0 	4.5	4.5
1	Data Scientist	$64K - $106K (Glassdoor est.)	"Secure our Nation, Ignite your Future
Overview
Each day U.S. Customs and Border Protection (CBP) oversees the massive flow of people, capital, and products that enter and depart the United States via air, land, sea, and cyberspace. The volume and complexity of both physical and virtual border crossings require the application of solutions to promote efficient trade and travel. Further, effective solutions help CBP ensure the movement of people, capital, and products is legal, safe, and secure.
As a Data Scientist on our team, a proven track record of delivering production ready decision support tools and applications employed in the field and by mission-support entities. Further, highly competitive applicants will have a demonstrated capacity to: work closely and collaboratively with mission stakeholders; respond to emergent, mission-driven changes in priorities and expected outcomes; and, apply new and emerging tools and techniques."	5.0	"ManTech International Corporation
4.3"	Alexandria, VA	5001 to 10000 Employees	1968	Company - Public	Research & Development	Business Services	$1 to $2 billion (USD)	4.2 	4.2 	4.2	4.2
2	Scientist I or II	$64K - $106K (Glassdoor est.)	"BioFire Diagnostics (BFDX), LLC. is looking for a Scientist I or II to join Research and Development department. This is a full time exempt position.
The Scientist's primary responsibility will be to initiate, design and execute the development of new BFDX’s molecular diagnostic products. The scientist will also be expected to investigate the feasibility of applying a wide variety of scientific principles and concepts to potential inventions, productions and problems.
Candidate is expected to have strong analytical and problem-solving skills, an excellence in experimental design, troubleshooting, and data analysis, the ability to execute and multi-task activities with minimal supervision in a fast-pace environment as well as the ability to manage a small team of research staff"	5.0	BioFire Diagnostics, LLC.	Salt Lake City, UT	-1	-1	-1	-1	-1	-1	-1	-1	-1	-1
3	Product Development Scientist	$64K - $106K (Glassdoor est.)	"Product Development Scientist
Zentis is Europe's number one fruit processing company and one of the leading brand manufacturers of jams, sweets and custard-based dessert. The Company's North American operations are located in Philadelphia, Pennsylvania and Plymouth, Indiana, where we produce fruit and dairy preparations for a variety of customers including yogurt, ice cream and bakery manufacturers.
The Product Development Scientist is responsible for developing new products and technologies with strategically importance to Zentis, ultimately leading to the growth and stability of the business. This is accomplished by fostering close interactions with Sales and Zentis customers to effectively manage projects and develop new business."	5.0	Zentis North America	Plymouth, IN	-1	-1	-1	-1	-1	-1	-1	-1	-1	-1
4	Data Scientist	$64K - $106K (Glassdoor est.)	"Are you passionate about using data, finding insights, and trying to explain why things are what they are? If so, read on.

As part of the advanced analytics team, the Data Scientist will be a key player on an innovative team that develops and provides actionable insights across the organization. S/he will help to evolve existing forecasting methodologies across different parts of the organization and develop sophisticated models, using machine learning algorithms and advanced analytics. This role will be responsible for developing long and short-term product demand forecasts in multiple markets and across multiple channels to help drive down supply chain costs (freight, inventory levels). The successful individual will conduct multiple tasks and projects simultaneously, maintain strong relationships with stakeholders, and own deliverables end to end.

TaylorMade Golf Company is an equal opportunity employer. All qualified applicants receive consideration for employment without regard to race, religious creed, color, national origin or ancestry, physical or mental disability, medical condition, genetic information, marital status, sex, pregnancy, gender, gender identity, gender expression, age, sexual orientation, military and veteran status or any other basis protected by federal, state or local law, ordinance, or regulation."	5.0	"TaylorMade Golf
4.3"	Carlsbad, CA	1001 to 5000 Employees	1979	Company - Private	Consumer Products Manufacturing	Manufacturing	$500 million to $1 billion (USD)	3.8 	4.6 	3.8	4.3
5	Spark/Big Data Engineer	$64K - $106K (Glassdoor est.)	The Data Consumption team of Data Security & Infrastructure (DSI) is seeking a highly motivated Spark / Big Data Developer to start or continue an IT career on the Big Data Platform project. Teaming up with architects, scrum masters, leads, managers and directors, you will work in an Agile environment to make the data on the Big Data Platform accessible for the needs of the organization through Atomic Models and Analytical Data Stores. In this role, you will coordinate with a variety of IT departments to elicit and translate high level business requirements into detailed system requirements. You will participate in the entire software development lifecycle by writing and executing test plans, finding solutions to issues during development and after deployment. You should be intellectually curious, have a solutions-oriented attitude and enjoy learning new tools and techniques.	5.0	GEICO	Chevy Chase, MD	-1	-1	-1	-1	-1	-1	-1	-1	-1	-1
6	Senior Data Scientist	$64K - $106K (Glassdoor est.)	"Working out of our Chevy Chase, MD/Washington DC office, GEICO’s Data Science team uses predictive analytics and innovative machine learning models to create value from data. We solve problems across GEICO, from Marketing to Claims and Underwriting, and are responsible for developing and driving strategic modeling initiatives. We see our projects through the entire data science lifecycle, from problem definition to data exploration, data munging, modeling, analysis, and deployment into production systems. We maintain a close partnership with IT to ensure that our models can be deployed quickly and monitored in a flexible deployment framework.
As a Senior Data Scientist, you will serve as a technical and thought leader on this diverse and highly skilled team. You will design and develop inventive solutions to drive innovation and delivery of organizational value. You’ll synthesize large datasets and solve complex problems through the use of advanced machine learning and statistical modeling. You’ll work in a highly collaborative, team environment, guiding and mentoring junior data scientists and collaborating with multiple stakeholders. You will assist management in the communication of insights and the implementation of impactful data science solutions across the organization."	5.0	"GEICO
3.5"	Chevy Chase, MD	10000+ Employees	1936	Subsidiary or Business Segment	Insurance Carriers	Insurance	$10+ billion (USD)	4.0 	3.5 	3.7	3.1
7	Principal Data Scientist	$64K - $106K (Glassdoor est.)	"Working out of our Chevy Chase, MD/Washington DC office, GEICO's Data Science team uses predictive analytics and innovative machine learning models to create value from data. We solve problems across GEICO, from Marketing to Claims and Underwriting, and are responsible for developing and driving strategic modeling initiatives. We see our projects through the entire data science lifecycle, from problem definition to data exploration, data munging, modeling, analysis, and deployment into production systems. We maintain a close partnership with IT to ensure that our models can be deployed quickly and monitored in a flexible deployment framework.
As a Principal Data Scientist, you will work with a talented and diverse team of data scientists with responsibility to:"	5.0	GEICO	Chevy Chase, MD	-1	-1	-1	-1	-1	-1	-1	-1	-1	-1
8	Data Engineer	$64K - $106K (Glassdoor est.)	"The Data Engineer will work with apart of the Global Analytics Team within Global Professional Services. This role will work with a variety of Lexmark teams including Service Operations, Engineering, R&D, and IT. This role will work directly with Lexmark’s customers as needed to develop new capabilities for Lexmark’s IoT initiative. Dive into technical project work to help Predictive Service Management increase customer up time and reduce Lexmark costs. Leverage and create cutting-edge predictive models and supporting technologies to build better services and support for Lexmark print and IoT devices.
Responsibilities:
Work with cross-functional resources including IT, Hardware/Firmware/Software Development Engineering, and Service Operations teams within Lexmark"	5.0	"Lexmark International, Inc.
3.8"	Lexington-Fayette, KY	10000+ Employees	1991	Company - Private	Computer Hardware & Software	Information Technology	$2 to $5 billion (USD)	3.7 	3.9 	3.2	4.1
9	Data Engineer	$64K - $106K (Glassdoor est.)	"Numerator is a data and tech company bringing speed and scale to market research. Headquartered in Chicago, IL, Numerator has more than 2,000 employees worldwide. The company blends proprietary data with advanced technology to create unique insights for the market research industry that has been slow to change. The majority of Fortune 100 companies are Numerator clients.
Job Description
Numerator is looking for a Data Engineer who is a Big Data enthusiast and has a passion for working with an interesting robust set of data. This person will work in our platform to help ensure that our data quality is flawless. As a company, we have millions of new data points every day that come into our system. You will be working with a passionate team of engineers to solve challenging problems and ensure that we can deliver the best data to our customers, on-time. You will be using the latest cloud data warehouse technologies to build robust and reliable data pipelines."	5.0	Numerator	Chicago, IL	-1	-1	-1	-1	-1	-1	-1	-1	-1	-1
10	Data & Analytics Consultant	$64K - $106K (Glassdoor est.)	"WHO WE LOOK FOR

An SEI Consultant is a master communicator and active listener who understands how to navigate an audience. Self-aware, almost to a fault, SEI consultants keenly understand how to adjust their approach based on the situation. Following a logical, fact-based approach, our consultants possess the superior ability to see correlations others may not, ask the right questions and drive solutions.

As super-connectors, our consultants connect not only people, but data, trends and experiences. Mature, humble, and genuine, SEI Consultants frequently go above and beyond for both their clients and their colleagues. SEI Consultants are ethical and trustworthy individuals who do what they say. SEI Consultants have an insatiable curiosity and . These individuals are commonly . Their passion for learning is infectious and excites others.

As every project is different, an SEI Consultant must be with unexpected situations. An SEI Consultant must be at ease with ambiguity because although a client knows that a problem exists – they need SEI to figure it out and drive a solution. SEI Consultants define ambition differently. SEI Consultants are who like to hang out with colleagues outside of work. Whether it be cooking, traveling, hiking, or volunteering, SEI Consultants enjoy working with genuine, thoughtful folks who want to steer clear of the traditional grind and share the joy of day-to-day life and activities with colleagues, friends and family.



Our consultants work with clients at all levels of the organization, from the C-suite to the shop floor, helping them to deliver on their most strategic initiatives. We’re known for making realistic, data-driven decisions that deliver value in tangible ways to our clients. Our clients ask for us on projects that require a superior combination of technical and business capabilities, people and management skills, and a collaborative mindset. We excel in understanding complex programs and strategic initiatives and breaking them into actionable pieces.

We are actively looking for professionals in the following areas:
The ideal candidate will:
Ideal candidates may call themselves Data Engineers, Data Scientists and Analysts and Data Governance professionals. Experience may include but is not limited to the following:"	5.0	"SEI
4.6"	Cincinnati, OH	201 to 500 Employees	1992	Company - Private	Consulting	Business Services	$50 to $100 million (USD)	4.6 	4.6 	4.5	4.5
11	Clinical Genetic Scientist	$64K - $106K (Glassdoor est.)	"Experience and Qualifications:
· Familiarity with and experience in molecular genetics testing methodologies.
· Familiarity with databases, tools, and resources commonly used in interpretation of genomic data.
· Excellent attention to detail; strong problem solving and decision making skills.
· Ability to work on multiple assignments concurrently within established timeframes."	5.0	SMA Medical Laboratory	Feasterville Trevose, PA	-1	-1	-1	-1	-1	-1	-1	-1	-1	-1
12	Scientist III, Analytical Development	$64K - $106K (Glassdoor est.)	"DESCRIPTION
The scientist III will be responsible for analytical method development and transfer under minimal supervision.
JOB DESCRIPTION
The role of the Scientist III, Analytical Development is to serve in an advanced technical role in the Analytical and Process Development laboratories. The key responsibilities of this role will be to develop, transfer, optimize and qualify/validate test methods for client projects. The Scientist III will be required to have advanced, practical experience with multiple analytical methods in a cGMP environment. These assays include, but are not limited to, cell-based assays (potency, activity), viral titration methods (plaque assay, TCID50), ddPCR, qPCR, HPLC, ELISA, FACS, as well as mammalian tissue culture."	5.0	Matica Biotechnology	College Station, TX	-1	-1	-1	-1	-1	-1	-1	-1	-1	-1
13	Research Scientist I - Essentia	$64K - $106K (Glassdoor est.)	"New product development of broths, stocks, flavors, animal fats and functional collagen products; lead and conduct pilot plant and production plant trials; support operations with technical expertise to improve quality / reduce cost of existing products; collaborate and provide technical support to internal cross functional groups and external customers; propose and identify new technological opportunities.
JOB QUALIFICATIONS:
Education and Experience:
Bachelor of Science degree plus a minimum of 4 years of experience"	5.0	"The Lauridsen Group
2.8"	Ankeny, IA	501 to 1000 Employees	1969	Company - Public	Miscellaneous Manufacturing	Manufacturing	Unknown / Non-Applicable	3.3 	2.5 	2.7	2.7
14	Staff Data Scientist	$64K - $106K (Glassdoor est.)	"Alteryx is searching for a Staff Data Scientist in our Boston office.
We’re looking for problem solvers, innovators, and dreamers who are searching for anything but business as usual. Like us, you’re a high performer who’s an expert at your craft, constantly challenging the status quo. You value inclusivity and want to join a culture that empowers you to show up as your authentic self. You know that success hinges on commitment, that our differences make us stronger, and that the finish line is always sweeter when the whole team crosses together.
Alteryx Innovation Labs
The Innovation Labs office, Alteryx's first office presence in Boston, was started earlier this year by the acquisition of MIT-spinout Feature Labs . This rapidly growing team combines the excitement of being part of a fast-paced, innovative startup with the resources, market penetration, and wisdom of a data analytics market leader. Our goal is to turbo-charge machine learning and data science efforts on the Alteryx platform, and to enable anyone to solve dynamic problems. We are working on high-impact, high-visibility projects, and we’re looking for collaborative and knowledge-hungry teammates who want to join us as we work to democratize machine learning."	5.0	"Alteryx, Inc.
3.6"	Boston, MA	1001 to 5000 Employees	1997	Company - Public	Enterprise Software & Network Solutions	Information Technology	$100 to $500 million (USD)	4.0 	3.5 	3.8	3.6
15	Scientist	$64K - $106K (Glassdoor est.)	"At ACON labs, we are making a difference in medical care by offering medical devices for diagnosing a variety of conditions. In addition, we are able to streamline and reduce costs for the physician and/or patient directly.
We are looking for a Scientist to research and develop product according to marketing or management team input, conduct validation studies, clinical studies, data analysis and prepare technical files for regulatory submission. This position will be working with departments in San Diego and in the Tijuana Production facility to provide technical support, product development progression and lead daily project activities.
The essential duties/responsibilities for this position are:"	5.0	"ACON Laboratories
2.5"	San Diego, CA	1001 to 5000 Employees	-1	Company - Private	Biotech & Pharmaceuticals	Biotech & Pharmaceuticals	$1 to $5 million (USD)	2.3 	1.9 	2.5	3.1
16	Data Scientist	$64K - $106K (Glassdoor est.)	"Data Scientist

Language: English

Location: Memphis, TN

Travel: <10>

Buckman is a privately held, global specialty chemical company with headquarters in Memphis, TN, USA, committed to safeguarding the environment, maintaining safety in the workplace, and promoting sustainable development. Buckman delivers exceptional service and innovative solutions to our customers globally in the pulp and paper, leather, and water treatment sectors to help boost productivity, reduce risk, improve product quality, and provide a measurable return on investment. Buckman is in the middle of a digital transformation of its businesses and focused on building the capabilities and tools in support of this.


Buckman is seeking an experienced Data Scientist to lead the development of a Data Science program at our Memphis facility. You will work closely with Buckman stakeholders to derive deep industry knowledge across paper, water, leather, and performance chemical industries. You will help develop a data strategy for the company including collection of the right data, creation of the data science project portfolio, partnering with external providers, and augmenting capabilities with additional internal hires. A large part of the job is communicating and developing relationship with key stakeholders and subject matter experts to tee up proofs of concept projects to demonstrate how data science can be used to solve old problems in unique and novel ways. You will not have a large internal team to rely on, at least initially, so individual expertise, breadth of data science knowledge, and ability to partner with external companies will be essential for success. In addition to the pure data science problems, you will be working closely with a multi-disciplinary team consisting of sensor scientists, software engineers, network engineers, mechanical/electrical engineers, and chemical engineers in the development, and deployment of IoT solutions. If you like working for an entrepreneurial company with a Sustainability mission and digital ambitions at the core of its strategy, Buckman is the place for you."	5.0	"Buckman
3.8"	Memphis, TN	1001 to 5000 Employees	1945	Company - Private	Chemical Manufacturing	Manufacturing	$500 million to $1 billion (USD)	4.0 	3.8 	3.5	3.5
17	Scientist I, Immunology	$64K - $106K (Glassdoor est.)	"At DiCE Molecules, we design and develop innovative therapies in immunology for patients with debilitating disease. Seeking to create a future where convenient oral medicines with biologic-like efficacy are available to patients with serious medical conditions, we are developing oral alternatives to medicines currently limited to injectable forms.
Essential Functions:
We are looking for an enthusiastic Immunology Scientist to make critical contributions to our growing immunology pipeline. In our fast-paced startup environment, the successful candidate will:
Develop and execute a variety of in vitro and in vivo assays in support of our small molecule efforts in a variety of immunology indications"	5.0	DiCE Molecules SV, Inc.	South San Francisco, CA	-1	-1	-1	-1	-1	-1	-1	-1	-1	-1
18	Principal Scientist	$64K - $106K (Glassdoor est.)	"Company Description
Personalized immunotherapies are the future of the fight against cancer, and IsoPlexis (www.isoplexis.com) is Making the Difference in enabling the lofty goal of employing immunotherapies to combat our toughest diseases. Our integrated systems, named #1 Innovation by Scientist Magazine & World-Leading Design by Red Dot, are changing cancer research by connecting biological readouts to what is actually happening in patients. Our game changing hardware technologies, originally from Cal Tech and Yale, combined with our next generation software and data visualizations, are powered by our amazing R&D team and used throughout the world. We work with a growing list of leading researchers who are publishing findings that connect our readouts to what is truly happening in patients, and that excites & drives all of us to do more! If you like working at the intersection of biological sciences and healthcare, and you enjoy intellectually challenging yet fulfilling projects, give us a call. Our fast growing, 125+ person team has a sense of integrity, energy, and urgency to ‘make things happen’ in our collective careers and in the broader world, and we look forward to talking."	5.0	"IsoPlexis
3.7"	Branford, CT	1 to 50 Employees	-1	Company - Private	-1	-1	Less than $1 million (USD)	3.1 	3.6 	3.9	3.1
19	Image Scientist - Fort Belvoir, VA	$64K - $106K (Glassdoor est.)	"Overview: Railhead, Inc. is currently hiring multiple Image Scientists ranging from three (3) years of experience to senior SMEs with more than ten (10+) years of experience supporting NGA's Integration Test & Image Quality Office (TAC) at Fort Belvoir, VA. A TS/SCI clearance is required.
Responsibilities: This is a unique opportunity to enhance your career by working with the community subject matter experts, directly with the customer and with project autonomy not customarily given as a government contractor. Based on the priorities of the customer, the image scientist will support product evaluations, quality studies, new product initializations, product algorithm assessments, or develop image quality equations to quantify the expected quality of a system given various parameters. Candidate should have a working understanding and practical application of modeling components of the image path to include sensor, detector, atmospheric, and material properties. Imaging systems could include electrical-optical, radar, lidar, hyperspectral and/or multispectral on board space or airborne platforms. Simulation and modeling experience and ability to develop algorithm description documentation for software development is needed. Familiarity with current GEOINT systems, products and development, as well as the exploitation software packages will be necessary to develop test and verification methodologies. The candidate will work within an existing team to complete tasks as prioritized by government customers. Good communication and team work is necessary. A history of delivering results is critical to success."	5.0	Railhead, Inc.	Fort Belvoir, VA	Unknown	-1	Company - Private	-1	-1	Less than $1 million (USD)	-1	-1	-1	-1
